{
  "schema_version": "1.1.0",
  "clarification_id": "cwnu.cs.2026.initial-review.questions",
  "review_id": "cwnu.cs.2026.initial-rules",
  "state": "applied",
  "coverage_mode": "full_review",
  "scope": {
    "curriculum_year": 2026,
    "admission_year": 2026,
    "department": "컴퓨터공학과"
  },
  "input_snapshots": [
    {
      "artifact_id": "review:cwnu.cs.2026.initial-rules",
      "sha256": "01e04bda5cebfc9d2c097dc8562c8fe216198fd84ea10e2f2391baea27eadda3"
    },
    {
      "artifact_id": "source:cwnu.curriculum.2026.changwon-undergraduate",
      "sha256": "1880a803b2954344ed42fcc24bb7ce074ffe73164705422ec5309a3496a115bd"
    },
    {
      "artifact_id": "rule:cwnu.cs.2026.credits.general-balanced",
      "sha256": "95d09375bd43148dfbabe50cade7a4b81740591f439c960d8163cc8ddb71731d"
    },
    {
      "artifact_id": "rule:cwnu.cs.2026.credits.general-foundation",
      "sha256": "f9681674f9ef960ca5b68456b90259f4dc91a32d287997904bf672b353c44671"
    },
    {
      "artifact_id": "rule:cwnu.cs.2026.credits.general-remaining",
      "sha256": "32a161431c9b031e538bfd4692fde6eb57f87e2256c330f4617d99caf37ece65"
    },
    {
      "artifact_id": "rule:cwnu.cs.2026.credits.general-total",
      "sha256": "e29722b272b889cbd116bf7c297c9e551ff4671a6019f6ffe1af74189571da8e"
    },
    {
      "artifact_id": "rule:cwnu.cs.2026.credits.graduation-remaining",
      "sha256": "6ebffee14d0bd092c7f1bc0b4211538039b82a25ac446b952c5d2f97b1208f54"
    },
    {
      "artifact_id": "rule:cwnu.cs.2026.credits.graduation-total",
      "sha256": "3529e15d099619ee31f01dedaaff3c1fb24d512d0edc30aa8a086d08891ede7c"
    },
    {
      "artifact_id": "rule:cwnu.cs.2026.credits.major-advanced",
      "sha256": "93d1e7cc65d1970cbab1b9aa384b39151f08e471d3807546f679c8a169e64fa0"
    },
    {
      "artifact_id": "rule:cwnu.cs.2026.credits.major-elective",
      "sha256": "9e84f380d9b4004e3fc02f6687c67d198a25acac5809fbb437d7086dde5e60a7"
    },
    {
      "artifact_id": "rule:cwnu.cs.2026.credits.major-minimum",
      "sha256": "b69437d13e2c898c0bb83f5611c80878b7f0a3d79cce69095c0e5f9f807150dc"
    },
    {
      "artifact_id": "rule:cwnu.cs.2026.credits.major-required",
      "sha256": "01dceab9c09773fad787596a03d57161d3880ee2a1caac50001f7b3413a67bda"
    },
    {
      "artifact_id": "rule:cwnu.cs.2026.credits.major-total",
      "sha256": "0409e7a94b6271150a48436947e9c0e4d13db85805b8951b0a101777bf88cf5a"
    },
    {
      "artifact_id": "rule:cwnu.cs.2026.graduation.thesis-required",
      "sha256": "c66035a678aef31f5bbd5a1b88eac798eab07bbf06e14b0dd54a8261138f102d"
    },
    {
      "artifact_id": "rule:cwnu.cs.2026.graduation.thesis-substitution",
      "sha256": "5e539e507262dcd111aaf6a29f57d7ecc6202b83f6bd1ed9ea3fd6d40c2b2796"
    }
  ],
  "session": {
    "session_id": "cwnu.cs.2026.review-session-001",
    "run_id": "20260918-academic-clarification-v1",
    "thread_binding": "current_task",
    "state": "closed",
    "started_at": "2026-09-18T14:30:00+09:00",
    "ended_at": "2026-09-18T16:27:06+09:00",
    "end_reason": "completed",
    "authority": {
      "kind": "department_confirmation",
      "status": "expired",
      "authorization_prompt": "이번 검수 세션에서 사용자의 명시적 답변을 컴퓨터공학과 확인으로 기록해도 됩니까?",
      "choices": [
        "grant",
        "decline"
      ]
    }
  },
  "batches": [
    {
      "batch_id": "source",
      "ordinal": 1,
      "topic": "출처 신원과 적용 범위",
      "status": "applied",
      "questions": [
        {
          "question_id": "source.identity-scope",
          "subject_ids": [
            "cwnu.curriculum.2026.changwon-undergraduate"
          ],
          "purpose": "review_confirmation",
          "ambiguity_kind": "source_identity_and_scope",
          "required_authority": "department_confirmation",
          "evidence": [
            {
              "subject_id": "cwnu.curriculum.2026.changwon-undergraduate",
              "source_id": "cwnu.curriculum.2026.changwon-undergraduate",
              "authority": "curriculum",
              "locator": "원본 PDF 전체와 등록 SHA-256 | PDF p.13 (printed p.5): 교육과정 입학연도 적용 원칙 | PDF p.18 (printed p.10): 2026학년도 교육과정 적용자 안내",
              "claim": "title=교육과정 2026; sha256=0d800318dc367a89518f9be6be8f559092474bf00b3573e14bd37b6c44b54471; authority=curriculum; curriculum_years=2026; admission_years=2026; departments=컴퓨터공학과"
            }
          ],
          "prompt": "등록된 PDF의 제목·SHA-256·교육과정 권위와 '2026 교육과정은 2026학번 컴퓨터공학과에 적용' 관계를 한 묶음으로 승인합니까?",
          "impact": "승인 전에는 SourceEntry와 이를 참조하는 모든 규칙을 학생 대상 supported 답변에 사용할 수 없습니다.",
          "choices": [
            {
              "choice_id": "confirm",
              "label": "모두 맞음",
              "disposition": "approve",
              "impact": "출처 전체 검수를 승인 후보로 전달합니다."
            },
            {
              "choice_id": "correct",
              "label": "수정 필요",
              "disposition": "needs_revision",
              "impact": "출처를 보류하고 수정 내용을 다시 질문합니다.",
              "comment_required": true
            },
            {
              "choice_id": "defer",
              "label": "판단 보류",
              "disposition": "pending",
              "impact": "출처와 하위 규칙을 미승인 상태로 유지합니다."
            }
          ],
          "recommended_choice_id": "confirm",
          "blocking_subject_ids": [
            "cwnu.curriculum.2026.changwon-undergraduate"
          ],
          "status": "accepted"
        }
      ]
    },
    {
      "batch_id": "credits",
      "ordinal": 2,
      "topic": "교양·전공·졸업학점",
      "status": "applied",
      "questions": [
        {
          "question_id": "credits.general",
          "subject_ids": [
            "cwnu.cs.2026.credits.general-foundation",
            "cwnu.cs.2026.credits.general-balanced",
            "cwnu.cs.2026.credits.general-remaining",
            "cwnu.cs.2026.credits.general-total"
          ],
          "purpose": "review_confirmation",
          "ambiguity_kind": "table_structure",
          "required_authority": "department_confirmation",
          "evidence": [
            {
              "subject_id": "cwnu.cs.2026.credits.general-foundation",
              "source_id": "cwnu.curriculum.2026.changwon-undergraduate",
              "authority": "curriculum",
              "locator": "PDF p.23 (printed p.15), p.261 (printed p.253), p.577 (printed p.569): 컴퓨터공학과 학점표의 기초교양 열",
              "claim": "기초교양 9"
            },
            {
              "subject_id": "cwnu.cs.2026.credits.general-balanced",
              "source_id": "cwnu.curriculum.2026.changwon-undergraduate",
              "authority": "curriculum",
              "locator": "PDF p.23 (printed p.15), p.261 (printed p.253), p.577 (printed p.569): 컴퓨터공학과 학점표의 균형교양 열",
              "claim": "균형교양 12"
            },
            {
              "subject_id": "cwnu.cs.2026.credits.general-remaining",
              "source_id": "cwnu.curriculum.2026.changwon-undergraduate",
              "authority": "curriculum",
              "locator": "PDF p.23 (printed p.15), p.261 (printed p.253), p.577 (printed p.569): 컴퓨터공학과 학점표의 교양 잔여학점 열",
              "claim": "교양 잔여학점 13"
            },
            {
              "subject_id": "cwnu.cs.2026.credits.general-total",
              "source_id": "cwnu.curriculum.2026.changwon-undergraduate",
              "authority": "curriculum",
              "locator": "PDF p.23 (printed p.15), p.261 (printed p.253), p.577 (printed p.569): 컴퓨터공학과 학점표의 교양 소계 열",
              "claim": "교양 소계 34"
            }
          ],
          "prompt": "26학번 컴퓨터공학과 교양 기준이 기초 9·균형 12·잔여 13·합계 34학점으로 모두 맞습니까?",
          "impact": "수정 또는 보류 시 이 네 규칙만 needs_review로 남고 다른 묶음 검수는 계속됩니다.",
          "choices": [
            {
              "choice_id": "confirm",
              "label": "모두 맞음",
              "disposition": "approve",
              "impact": "교양 규칙 4건을 승인 후보로 전달합니다."
            },
            {
              "choice_id": "correct",
              "label": "수정 필요",
              "disposition": "needs_revision",
              "impact": "교양 규칙 4건을 보류하고 수정값을 다시 확인합니다.",
              "comment_required": true
            },
            {
              "choice_id": "defer",
              "label": "판단 보류",
              "disposition": "pending",
              "impact": "교양 규칙 4건을 미승인 상태로 유지합니다."
            }
          ],
          "recommended_choice_id": "confirm",
          "blocking_subject_ids": [
            "cwnu.cs.2026.credits.general-foundation",
            "cwnu.cs.2026.credits.general-balanced",
            "cwnu.cs.2026.credits.general-remaining",
            "cwnu.cs.2026.credits.general-total"
          ],
          "status": "accepted"
        },
        {
          "question_id": "credits.major",
          "subject_ids": [
            "cwnu.cs.2026.credits.major-required",
            "cwnu.cs.2026.credits.major-elective",
            "cwnu.cs.2026.credits.major-minimum",
            "cwnu.cs.2026.credits.major-advanced",
            "cwnu.cs.2026.credits.major-total"
          ],
          "purpose": "review_confirmation",
          "ambiguity_kind": "table_structure",
          "required_authority": "department_confirmation",
          "evidence": [
            {
              "subject_id": "cwnu.cs.2026.credits.major-required",
              "source_id": "cwnu.curriculum.2026.changwon-undergraduate",
              "authority": "curriculum",
              "locator": "PDF p.23 (printed p.15), p.261 (printed p.253), p.577 (printed p.569): 컴퓨터공학과 학점표의 전공필수 열",
              "claim": "전공필수 21"
            },
            {
              "subject_id": "cwnu.cs.2026.credits.major-elective",
              "source_id": "cwnu.curriculum.2026.changwon-undergraduate",
              "authority": "curriculum",
              "locator": "PDF p.23 (printed p.15), p.261 (printed p.253), p.577 (printed p.569): 컴퓨터공학과 학점표의 전공선택 열",
              "claim": "전공선택 24"
            },
            {
              "subject_id": "cwnu.cs.2026.credits.major-minimum",